{
  "name": "trello",
  "display_name": "Trello",
  "description": "Manage Trello boards, lists, and cards",
  "category": "productivity",
  "author": "openclaw",
  "author_github": "openclaw",
  "version": "1.0.0",
  "tags": [
    "trello",
    "kanban",
    "project-management",
    "boards"
  ],
  "compatible_adapters": [
    "claude-code"
  ],
  "source": {
    "repo": "openclaw/openclaw",
    "path": "skills/trello",
    "branch": "main",
    "url": "https://github.com/openclaw/openclaw/tree/main/skills/trello"
  },
  "stats": {
    "github_stars": 391757,
    "updated_at": "2026-10-12"
  },
  "has_scripts": false,
  "file_count": 1,
  "license": "MIT"
}
