{
  "name": "songsee",
  "display_name": "SongSee",
  "description": "Identify songs playing nearby using audio recognition",
  "category": "media",
  "author": "openclaw",
  "author_github": "openclaw",
  "version": "1.0.0",
  "tags": [
    "music",
    "recognition",
    "shazam",
    "audio"
  ],
  "compatible_adapters": [
    "claude-code"
  ],
  "source": {
    "repo": "openclaw/openclaw",
    "path": "skills/songsee",
    "branch": "main",
    "url": "https://github.com/openclaw/openclaw/tree/main/skills/songsee"
  },
  "stats": {
    "github_stars": 391757,
    "updated_at": "2026-10-12"
  },
  "has_scripts": false,
  "file_count": 1,
  "license": "MIT"
}
