{
  "name": "model-usage",
  "display_name": "Model Usage",
  "description": "Track and display AI model token usage",
  "category": "development",
  "author": "openclaw",
  "author_github": "openclaw",
  "version": "1.0.0",
  "tags": [
    "tokens",
    "usage",
    "tracking",
    "costs"
  ],
  "compatible_adapters": [
    "claude-code"
  ],
  "source": {
    "repo": "openclaw/openclaw",
    "path": "skills/model-usage",
    "branch": "main",
    "url": "https://github.com/openclaw/openclaw/tree/main/skills/model-usage"
  },
  "stats": {
    "github_stars": 391757,
    "updated_at": "2026-10-12"
  },
  "has_scripts": true,
  "file_count": 4,
  "license": "MIT"
}
