{
  "name": "openai-image-gen",
  "display_name": "OpenAI Image Gen",
  "description": "Generate images using OpenAI DALL-E API",
  "category": "media",
  "author": "openclaw",
  "author_github": "openclaw",
  "version": "1.0.0",
  "tags": [
    "openai",
    "dalle",
    "image-generation",
    "ai"
  ],
  "compatible_adapters": [
    "claude-code"
  ],
  "source": {
    "repo": "openclaw/openclaw",
    "path": "skills/openai-image-gen",
    "branch": "main",
    "url": "https://github.com/openclaw/openclaw/tree/main/skills/openai-image-gen"
  },
  "stats": {
    "github_stars": 391757,
    "updated_at": "2026-10-12"
  },
  "has_scripts": true,
  "file_count": 3,
  "license": "MIT"
}
