{
  "name": "spotify-player",
  "display_name": "Spotify Player",
  "description": "Control Spotify playback \u2014 play, pause, search, queue",
  "category": "media",
  "author": "openclaw",
  "author_github": "openclaw",
  "version": "1.0.0",
  "tags": [
    "spotify",
    "music",
    "playback",
    "streaming"
  ],
  "compatible_adapters": [
    "claude-code"
  ],
  "source": {
    "repo": "openclaw/openclaw",
    "path": "skills/spotify-player",
    "branch": "main",
    "url": "https://github.com/openclaw/openclaw/tree/main/skills/spotify-player"
  },
  "stats": {
    "github_stars": 391757,
    "updated_at": "2026-10-12"
  },
  "has_scripts": false,
  "file_count": 1,
  "license": "MIT"
}
