{
  "name": "consistent-naming",
  "display_name": "Consistent Naming Conventions",
  "description": "Enforce consistent naming conventions across the codebase for variables, functions, classes, and files",
  "category": "style",
  "author": "community",
  "author_github": "",
  "version": "1.0.0",
  "tags": [
    "style",
    "naming",
    "conventions",
    "readability"
  ],
  "compatible_adapters": [
    "claude-code",
    "cursor",
    "windsurf"
  ],
  "scope": "project",
  "content": "## Consistent Naming Conventions\n\n### Variables & Functions\n- Use camelCase for variables and functions: `getUserName`, `isActive`\n- Use UPPER_SNAKE_CASE for constants: `MAX_RETRIES`, `API_BASE_URL`\n- Boolean variables start with is/has/can/should: `isLoading`, `hasError`\n- Functions start with a verb: `fetchData`, `calculateTotal`, `handleClick`\n\n### Classes & Types\n- Use PascalCase: `UserService`, `HttpClient`, `ApiResponse`\n- Interfaces don't use I prefix: `User` not `IUser`\n- Enums use PascalCase with PascalCase values: `Color.DarkBlue`\n\n### Files\n- React components: PascalCase (`UserProfile.tsx`)\n- Utilities/hooks: camelCase (`useAuth.ts`, `formatDate.ts`)\n- Test files: match source (`UserProfile.test.tsx`)\n\n### Avoid\n- Single letter names (except loop counters `i`, `j`)\n- Abbreviations unless universally understood (`btn` \u2192 `button`)\n- Negative booleans: `isNotReady` \u2192 `isReady` (invert logic)",
  "source": {
    "repo": "abhiunix/community-registry",
    "url": "https://github.com/abhiunix/community-registry/blob/main/rules/style/consistent-naming.json"
  },
  "stats": {
    "github_stars": 2,
    "updated_at": "2026-10-12"
  },
  "license": "MIT"
}
