{
  "name": "summarize",
  "display_name": "Summarize",
  "description": "Summarize text, articles, and documents",
  "category": "productivity",
  "author": "openclaw",
  "author_github": "openclaw",
  "version": "1.0.0",
  "tags": [
    "summarize",
    "text",
    "articles",
    "tldr"
  ],
  "compatible_adapters": [
    "claude-code"
  ],
  "source": {
    "repo": "openclaw/openclaw",
    "path": "skills/summarize",
    "branch": "main",
    "url": "https://github.com/openclaw/openclaw/tree/main/skills/summarize"
  },
  "stats": {
    "github_stars": 391757,
    "updated_at": "2026-10-12"
  },
  "has_scripts": false,
  "file_count": 1,
  "license": "MIT"
}
