{
  "name": "bluebubbles",
  "display_name": "BlueBubbles",
  "description": "Send and receive iMessages via BlueBubbles server",
  "category": "communication",
  "author": "openclaw",
  "author_github": "openclaw",
  "version": "1.0.0",
  "tags": [
    "imessage",
    "bluebubbles",
    "messaging",
    "macos"
  ],
  "compatible_adapters": [
    "claude-code"
  ],
  "source": {
    "repo": "openclaw/openclaw",
    "path": "skills/bluebubbles",
    "branch": "main",
    "url": "https://github.com/openclaw/openclaw/tree/main/skills/bluebubbles"
  },
  "stats": {
    "github_stars": 391757,
    "updated_at": "2026-10-12"
  },
  "has_scripts": false,
  "file_count": 1,
  "license": "MIT"
}
