{
  "name": "coding-agent",
  "display_name": "Coding Agent",
  "description": "Autonomous coding agent for complex development tasks",
  "category": "development",
  "author": "openclaw",
  "author_github": "openclaw",
  "version": "1.0.0",
  "tags": [
    "coding",
    "agent",
    "autonomous",
    "development"
  ],
  "compatible_adapters": [
    "claude-code"
  ],
  "source": {
    "repo": "openclaw/openclaw",
    "path": "skills/coding-agent",
    "branch": "main",
    "url": "https://github.com/openclaw/openclaw/tree/main/skills/coding-agent"
  },
  "stats": {
    "github_stars": 391757,
    "updated_at": "2026-10-12"
  },
  "has_scripts": false,
  "file_count": 1,
  "license": "MIT"
}
