{
  "name": "sonoscli",
  "display_name": "Sonos CLI",
  "description": "Control Sonos speakers \u2014 play, pause, volume",
  "category": "media",
  "author": "openclaw",
  "author_github": "openclaw",
  "version": "1.0.0",
  "tags": [
    "sonos",
    "speakers",
    "audio",
    "smart-home"
  ],
  "compatible_adapters": [
    "claude-code"
  ],
  "source": {
    "repo": "openclaw/openclaw",
    "path": "skills/sonoscli",
    "branch": "main",
    "url": "https://github.com/openclaw/openclaw/tree/main/skills/sonoscli"
  },
  "stats": {
    "github_stars": 391757,
    "updated_at": "2026-10-12"
  },
  "has_scripts": false,
  "file_count": 1,
  "license": "MIT"
}
