{
  "name": "imsg",
  "display_name": "iMessage",
  "description": "Send and read iMessages on macOS",
  "category": "communication",
  "author": "openclaw",
  "author_github": "openclaw",
  "version": "1.0.0",
  "tags": [
    "imessage",
    "messaging",
    "macos",
    "sms"
  ],
  "compatible_adapters": [
    "claude-code"
  ],
  "source": {
    "repo": "openclaw/openclaw",
    "path": "skills/imsg",
    "branch": "main",
    "url": "https://github.com/openclaw/openclaw/tree/main/skills/imsg"
  },
  "stats": {
    "github_stars": 391757,
    "updated_at": "2026-10-12"
  },
  "has_scripts": false,
  "file_count": 1,
  "license": "MIT"
}
