{
  "name": "no-secrets-in-code",
  "display_name": "No Secrets in Code",
  "description": "Prevent hardcoded secrets, API keys, tokens, and passwords from being committed to the codebase",
  "category": "security",
  "author": "community",
  "author_github": "",
  "version": "1.0.0",
  "tags": [
    "security",
    "secrets",
    "api-keys",
    "best-practices"
  ],
  "compatible_adapters": [
    "claude-code",
    "cursor",
    "windsurf"
  ],
  "scope": "project",
  "content": "## No Secrets in Code\n\nNEVER hardcode secrets, API keys, tokens, passwords, or connection strings in source code.\n\n### Rules\n- Use environment variables for all secrets\n- Use .env files (gitignored) for local development\n- Use a secrets manager (Vault, AWS Secrets Manager, etc.) in production\n- Never log secret values, even partially\n- Never include secrets in error messages\n- Check for patterns: API_KEY=, SECRET=, PASSWORD=, TOKEN=, private_key\n- Flag any string that looks like a base64-encoded key or JWT\n\n### What to do instead\n```\n# Bad\nconst API_KEY = \"sk-abc123...\";\n\n# Good\nconst API_KEY = process.env.API_KEY;\n```",
  "source": {
    "repo": "abhiunix/community-registry",
    "url": "https://github.com/abhiunix/community-registry/blob/main/rules/security/no-secrets-in-code.json"
  },
  "stats": {
    "github_stars": 2,
    "updated_at": "2026-10-12"
  },
  "license": "MIT"
}
