{
  "name": "mcporter",
  "display_name": "MCP Porter",
  "description": "Port and convert MCP servers",
  "category": "development",
  "author": "openclaw",
  "author_github": "openclaw",
  "version": "1.0.0",
  "tags": [
    "mcp",
    "porting",
    "conversion",
    "servers"
  ],
  "compatible_adapters": [
    "claude-code"
  ],
  "source": {
    "repo": "openclaw/openclaw",
    "path": "skills/mcporter",
    "branch": "main",
    "url": "https://github.com/openclaw/openclaw/tree/main/skills/mcporter"
  },
  "stats": {
    "github_stars": 391757,
    "updated_at": "2026-10-12"
  },
  "has_scripts": false,
  "file_count": 1,
  "license": "MIT"
}
