{
  "name": "ordercli",
  "display_name": "Order CLI",
  "description": "Track packages and delivery orders",
  "category": "integration",
  "author": "openclaw",
  "author_github": "openclaw",
  "version": "1.0.0",
  "tags": [
    "packages",
    "tracking",
    "delivery",
    "orders"
  ],
  "compatible_adapters": [
    "claude-code"
  ],
  "source": {
    "repo": "openclaw/openclaw",
    "path": "skills/ordercli",
    "branch": "main",
    "url": "https://github.com/openclaw/openclaw/tree/main/skills/ordercli"
  },
  "stats": {
    "github_stars": 391757,
    "updated_at": "2026-10-12"
  },
  "has_scripts": false,
  "file_count": 1,
  "license": "MIT"
}
